{
  "ascep_version": "0.1.0",
  "model_id": null,
  "model_id_u_reason": "(U) withheld \u2014 the model under test was a pre-release checkpoint and its identifier is not ours to publish. Every capacity figure below is reproducible against any MoE of the same total/active parameter split.",
  "revision": null,
  "revision_u_reason": "(U) not pinned at run time",
  "total_params": 26000000000,
  "active_params": 4000000000,
  "architecture": "moe",
  "moe_experts": null,
  "moe_experts_u_reason": "(U) expert layout not captured",
  "moe_top_k": null,
  "moe_top_k_u_reason": "(U) expert layout not captured",
  "weight_precision": "bf16",
  "kv_precision": "bf16",
  "n_layers": null,
  "n_layers_u_reason": "(U) not captured. Consequence: the analytic KV model cannot be evaluated for this report, so every KV figure here is the ENGINE-REPORTED value, which the protocol requires be preferred anyway (SPEC 'Formulas'). This is the single most instructive gap in this example.",
  "n_kv_heads": null,
  "n_kv_heads_u_reason": "(U) not captured. This is the field that decides whether per-GPU KV capacity FALLS as TP grows: once tensor_parallel exceeds it, kv_heads_per_rank floors at 1 and effective cluster KV heads grow with TP. Without it the observed TP=1/TP=2 flatness must not be extended to TP=4.",
  "head_dim": null,
  "head_dim_u_reason": "(U) not captured. Third of the three fields kv_bytes_per_token needs; see n_layers.",
  "attention_type": null,
  "attention_type_u_reason": "(U) not captured. Without it the applicable KV formula cannot even be selected, let alone evaluated \u2014 see chapter 2, Attention families.",
  "global_layer_frac": null,
  "global_layer_frac_u_reason": "(U) attention type unknown, so not applicable",
  "native_max_context_tokens": null,
  "native_max_context_tokens_u_reason": "(U) not captured; served length was 32768",
  "weight_bytes_on_disk": null,
  "weight_bytes_on_disk_u_reason": "(U) not recorded",
  "licence": null,
  "licence_u_reason": "(U) pre-release checkpoint; licence not public"
}
